file_name,uni,wylie,url,dept,grade,char_len,audio_len,path,inf
STT_AB00335_0109_849180_to_855827,ཅན་གྱི་གཙུག་གཡུ་ཞིག་ཡོད་པ་དེ་བཙན་འཕྲོག་བྱེད་པའི་ཆེད་དུ་ངའི་ཕ་མ་གཉིས་ལ་མནར་གཅོད་དྲག་པོ་བཏང་ནས་མ་ཤི་ཙམ་བཟོས།  ,can gyi gtsug g.yu zhig yod pa de btsan 'phrog byed pa'i ched du nga'i pha ma gnyis la mnar gcod drag po btang nas ma shi tsam bzos/__,https://d38pmlk0v88drf.cloudfront.net/wav16k/STT_AB00335_0109_849180_to_855827.wav,STT_AB,2,108,6.647,wav16k/STT_AB00335_0109_849180_to_855827.wav,ཅན་གྱི་གཙུག་གཡུ་ཞིག་ཡོད་པ་དེ་བཙན་ཕྲོགས་བྱེད་པའི་ཆེད་དུ་ངའི་ཕ་མ་གཉིས་ལ་མནར་གཅོད་དྲག་པོ་བཏང་ནས་མ་ཤི་ཙམ་བཟོས།
STT_AB00335_0097_775588_to_784940,མདའ་དཔོན་གྱི་མིག་གི་ནང་དུ་གློ་བུར་དུ་གང་ཟག་གི་སྣང་བརྙན་ཞིག་ཏུ་འགྱུར་བ་མ་ཟད། གཞོན་ནུ་འདི་ནི་ཆུང་དུས་ནས་རྣམ་རིག་བཀྲ་བའི་ཐོག་ལ། ད་ནི་ ,mda' dpon gyi mig gi nang du glo bur du gang zag gi snang brnyan zhig tu 'gyur ba ma zad/_gzhon nu 'di ni chung dus nas rnam rig bkra ba'i thog la/_da ni _,https://d38pmlk0v88drf.cloudfront.net/wav16k/STT_AB00335_0097_775588_to_784940.wav,STT_AB,2,131,9.352,wav16k/STT_AB00335_0097_775588_to_784940.wav,མདའ་དཔོན་གྱིས་མིག་གི་ནང་དུ་གློ་བུར་དུ་གང་ཟག་གི་སྣང་བརྙན་ཞིག་ཏུ་གྱུར་པ་མ་ཟད། གཞོན་ནུ་འདི་ནི་ཆུང་དུས་ནས་རྣམ་རིས་བཀྲ་བའི་ཐོག་ལ་ད་ནི་ལྟོ་
STT_AB00335_0099_794769_to_796749,དགྲ་ཤ་ལེན་དགོས་དོན་གང་ཡིན་ནམ་བསམས་ཏེ་ ,dgra sha len dgos don gang yin nam bsams te _,https://d38pmlk0v88drf.cloudfront.net/wav16k/STT_AB00335_0099_794769_to_796749.wav,STT_AB,2,38,1.98,wav16k/STT_AB00335_0099_794769_to_796749.wav,དགྲ་ཤ་ལེན་དགོས་དོན་གང་ཡིན་ནམ་བསམས་ཏེ་
STT_AB00335_0103_805332_to_815895,སྙིང་སྟོན་མཁན་མཐའ་དག་ལ་ངས་ཀྱང་སྙིང་སྟོན་གྱི་ཡོད་ལ། ལྷག་དོན་དུ་ཁྱོད་ནི་ཆུང་དུས་ངའི་སློབ་མ་བྱེད་མྱོང་ཞིང་། ཡུན་རིང་གཡོག་པོའང་རྒྱུག་མྱོང་ཡོད་པས་ཁྱོད་ལ་ག་རེ་ཤོད་རྒྱུ་ཡོད་ཀྱང་ ,snying ston mkhan mtha' dag la ngas kyang snying ston gyi yod la/_lhag don du khyod ni chung dus nga'i slob ma byed myong zhing /_yun ring g.yog po'ang rgyug myong yod pas khyod la ga re shod rgyu yod kyang _,https://d38pmlk0v88drf.cloudfront.net/wav16k/STT_AB00335_0103_805332_to_815895.wav,STT_AB,2,171,10.563,wav16k/STT_AB00335_0103_805332_to_815895.wav,སྙིང་སྟོན་མཁན་མཐའ་དག་ལ་ངས་ཀྱང་སྙིང་སྟོན་གྱི་ཡོད་ལ་ ལྷག་དོན་དུ་ཁྱོད་ནི་ཆུང་དུས་ངའི་སློབ་མ་བྱེད་མྱོང་ཞིང་། ཡུན་རིང་གཡོག་པོཡང་གྱོ་མྱོང་ཡོད་པས་ཁྱེད་ལ་ག་རེ་ཤོད་རྒྱུ་ཡོད་ཀྱང་
STT_AB00335_0104_815895_to_826459,ཤོད་ཅིག་ཅེས་ནན་ཏན་གྱིས་བཤད་དེ། ལོ་ན་ཕྲ་བའི་གཞོན་ནུ་འདིའི་ཁ་ནས་ཡ་མཚན་ཅན་གྱི་གསང་གཏམ་ཅི་འདྲ་ཞིག་ཐོས་ཡོང་ངམ་སྙམ་མུར་ཡིད་གཟབ་ཀྱིས་གཏམ་ལན་བསྒུགས་ནས་བསྡད།  ,shod cig ces nan tan gyis bshad de/_lo na phra ba'i gzhon nu 'di'i kha nas ya mtshan can gyi gsang gtam ci 'dra zhig thos yong ngam snyam mur yid gzab kyis gtam lan bsgugs nas bsdad/__,https://d38pmlk0v88drf.cloudfront.net/wav16k/STT_AB00335_0104_815895_to_826459.wav,STT_AB,2,150,10.564,wav16k/STT_AB00335_0104_815895_to_826459.wav,ཅོད་ཅིག་ཅེས་ནན་ཏན་གྱིས་བཤད་དེ། ལོ་ན་ྲ་བའི་གཞོན་ནུ་འདིའི་ཁ་ནས་ཡ་མཚན་ཅན་གྱི་སྲ་གཏམ་ཅི་འདྲ་ཞིག་ཐོན་ཡོང་ངམ་སྙམ་མུར་ཡིད་གཟབ་ཀྱིས་གཏམ་ལན་བསྒུགས་ནས་བསྡད།
STT_AB00335_0106_828472_to_835102,ངའི་ཕ་མ་གཉིས་ཀ་དཀོན་ཅོག་ལ་དད་གུས་ཆེ་ཞིང་། མགོ་འདྲེན་དཔོན་པོ་རྣམས་ལ་བརྩི་བཀུར་ཆེ་བ། ཀུན་ལ་སེམས་པ་བཟང་བ།  ,nga'i pha ma gnyis ka dkon cog la dad gus che zhing /_mgo 'dren dpon po rnams la brtsi bkur che ba/_kun la sems pa bzang ba/__,https://d38pmlk0v88drf.cloudfront.net/wav16k/STT_AB00335_0106_828472_to_835102.wav,STT_AB,2,104,6.63,wav16k/STT_AB00335_0106_828472_to_835102.wav,ངའི་ཕ་མ་གཉིས་ཀ་དཀོན་མཆོག་ལ་དད་གུས་ཆེ་ཞིང་སྒོ་འདྲེན་དཔོན་པོ་རྣམས་ལ་བརྩི་བཀུར་ཆེ་བ། ཀུན་ལ་སེམས་པ་བཟང་བ།
STT_AB00335_0094_746424_to_758438,ཉམས་ཆུང་ནུས་མེད་ཅིག་ཏུ་མཐོང་ཡང་། དེ་རིང་ནི་དོན་དང་ལྡན་པའི་གཏམ་འདི་ལྟ་བུ་གླེང་བ་མ་ཟད། སེམས་ཐག་ཆོད་པོས་ཕ་མའི་དགྲ་ཤ་ལེན་རྒྱུའི་ཆོད་སེམས་ཀྱང་བསྟན་པས་མདའ་དཔོན་ལ་ངོ་མཚར་ཆེན་པོ་སྐྱེས།  ,nyams chung nus med cig tu mthong yang /_de ring ni don dang ldan pa'i gtam 'di lta bu gleng ba ma zad/_sems thag chod pos pha ma'i dgra sha len rgyu'i chod sems kyang bstan pas mda' dpon la ngo mtshar chen po skyes/__,https://d38pmlk0v88drf.cloudfront.net/wav16k/STT_AB00335_0094_746424_to_758438.wav,STT_AB,2,178,12.014,wav16k/STT_AB00335_0094_746424_to_758438.wav,ཉམ་ཆུང་ནུས་མེད་ཅིག་ཏུ་མཐོང་ཡང་དེ་རིང་ནི་དོན་དང་ལྡན་པའི་གཏམ་འདི་ལྟ་བུ་གླེང་བ་མ་ཟད། སེམས་ཐག་ཆོད་པོས་ཕ་མའི་དགྲ་ཤ་ལེན་རྒྱུའི་ཆོད་སེམས་ཀྱང་བསྟན་པས་མདའ་དཔོན་ལ་ངོ་མཚར་ཆེན་པོ་སྐྱེས།
STT_AB00335_0096_766237_to_775588,རྣམ་ཀུན་སྦྱིན་བདག་གི་རྐང་པའི་གཡས་གཡོན་དུ་མཇུག་མ་བརླ་ཡི་བར་དུ་བཅུག་ནས་ཕར་འགྲོ་ཚུར་འགྲོ་བྱེད་མཁན་སྒོ་ཁྱི་ཞིག་གི་གནས་བབ་ལས་མི་མངོན་པའི་གཟུགས་སྣང་དེ་ནི། དེ་རིང་ ,rnam kun sbyin bdag gi rkang pa'i g.yas g.yon du mjug ma brla yi bar du bcug nas phar 'gro tshur 'gro byed mkhan sgo khyi zhig gi gnas bab las mi mngon pa'i gzugs snang de ni/_de ring _,https://d38pmlk0v88drf.cloudfront.net/wav16k/STT_AB00335_0096_766237_to_775588.wav,STT_AB,2,157,9.351,wav16k/STT_AB00335_0096_766237_to_775588.wav,རྣམ་ཀུན་སྦྱིན་བདག་གི་རྐང་པའི་གཡས་གཡོན་དུ་མཇུག་མ་སླ་ཡི་བར་དུ་བཅུག་ནས་ཕར་འགྲོ་ཚུར་འགྲོ་བྱེད་མཁན་སྒུ་ཁྱི་ཞིག་གི་གནས་བབ་ལས་མི་མངོན་པའི་གཟུངས་སྣང་དེ་ནི་དེ་རིང་
STT_AB00335_0113_884803_to_896021,ངའི་པ་ཕ་འདས་པོ་དེ་ཚེ་མ་ཟིན་པའི་ཉིན་མོ་དེ་རང་ལ་ངས་ཇོ་ཁང་གི་སྒོ་འགྲམ་དུ་དགྲ་ཤ་ལེན་རྒྱུའི་དམ་བཅའ་ཕུལ་ཚར་བ་ཡིན། ལོ་བཅུ་ལྷག་ཙམ་གྱི་རིང་ལ་ངས་ ,nga'i pa pha 'das po de tshe ma zin pa'i nyin mo de rang la ngas jo khang gi sgo 'gram du dgra sha len rgyu'i dam bca' phul tshar ba yin/_lo bcu lhag tsam gyi ring la ngas _,https://d38pmlk0v88drf.cloudfront.net/wav16k/STT_AB00335_0113_884803_to_896021.wav,STT_AB,2,136,11.218,wav16k/STT_AB00335_0113_884803_to_896021.wav,ངའི་པ་ཕ་འདས་པོ་དེ་ཚེ་མ་ཟིན་པའི་ཉིན་མོ་དེ་རང་ལ་ངས་ཇོ་ཁང་གི་སྒོ་འགྲམ་དུ་དགྲ་ཤ་ལེན་རྒྱུའི་དམ་བཅའ་ཕུལ་ཚར་བ་ཡིན། ལོ་བཅུ་ལྷག་ཙམ་གྱི་རིང་ལ་ངས་
STT_AB00335_0153_1227738_to_1237892,ཁྱེད་ཀྱིས་ཚའི་བཀའ་སློབ་དང་གཡོ་བ་མེད་པའི་རྒྱབ་སྐྱོར་གནང་བ་དེས་བདག་གི་བློ་སྟོབས་ཆེ་ཆེར་ཕེལ་ཏེ་ལུས་པོ་ཡོང་ནུས་ཤུགས་དང་སེམས་ཤུགས་ཀྱིས་ཁེངས་སོང་། བྱ་བ་ལམ་ལྷོངས་ཡོང་རྒྱུར་ ,khyed kyis tsha'i bka' slob dang g.yo ba med pa'i rgyab skyor gnang ba des bdag gi blo stobs che cher phel te lus po yong nus shugs dang sems shugs kyis khengs song /_bya ba lam lhongs yong rgyur _,https://d38pmlk0v88drf.cloudfront.net/wav16k/STT_AB00335_0153_1227738_to_1237892.wav,STT_AB,2,166,10.154,wav16k/STT_AB00335_0153_1227738_to_1237892.wav,ཁྱེད་ཀྱིས་ཤ་ཚའི་བཀའ་སློབ་དང་གཡོ་བ་མེད་པའི་རྒྱབ་སྐྱོར་གནང་བ་དེས་བདག་གི་བློ་སྟོབས་ཆེས་ཆིར་འཕེལ་ཏེ་ལུས་པོ་ཡོངས་རྫོགས་ནུས་ཤུགས་དང་སེམས་ཤུགས་ཀྱིས་ཁེངས་སོང་། བྱ་བ་ལམ་ལྷོང་ཡོང་རྒྱུར་
STT_AB00335_0111_862943_to_873353,ཁོ་རང་གཉིས་སྲོག་ཐར་ཙམ་བྱུང་ཡང་ངའི་སྲུ་མོ་ཞིག་ཡོད་པ་དེ་སྐུ་ངོ་རྫོང་གིས་བཟུང་ནས་བཙན་ཁྲིད་བྱས་ཏེ་ད་བར་གར་སོང་ཆ་རྟོགས་མེད་པ་མ་ཟད། ཕ་མ་གཉིས་ཀྱང་གཞན་ཡུལ་དུ་ ,kho rang gnyis srog thar tsam byung yang nga'i sru mo zhig yod pa de sku ngo rdzong gis bzung nas btsan khrid byas te da bar gar song cha rtogs med pa ma zad/_pha ma gnyis kyang gzhan yul du _,https://d38pmlk0v88drf.cloudfront.net/wav16k/STT_AB00335_0111_862943_to_873353.wav,STT_AB,2,151,10.41,wav16k/STT_AB00335_0111_862943_to_873353.wav,ཁོ་རང་གཉིས་སྲོག་ཐར་ཙམ་བྱུང་ཡང་ངའི་སྲུ་མོ་ཞིག་ཡོད་པ་དེ་སྐུ་ངོ་རྫོང་ན་གྱིས་བཟུང་ནས་བཙན་ཁྲིས་བྱས་ཏེ་ད་བར་གར་སོང་ཆག་དོགས་མེད་པ་མ་ཟད། ཕ་མ་གཉིས་ཀྱང་གཞན་ཡུལ་དུ་
STT_AB00335_0112_873353_to_883762,དཀའ་དུབ་ཚད་མེད་མྱངས་ཤིང་། ལུས་ལ་གཅོང་ནད་ཞུགས་པའི་རྐྱེན་གྱིས་མཐར་ཚེ་ལས་འདས། སྐུ་ངོ་རྫོང་དཔོན་ཟེར་བའི་དགྲ་ངན་དེ་ནི་ང་ཚོ་མི་ཤི་ཁྱིམ་སྟོངས་བཟོ་མཁན་གྱི་གཤེད་མ་རང་ཡིན་པས།  ,dka' dub tshad med myangs shing /_lus la gcong nad zhugs pa'i rkyen gyis mthar tshe las 'das/_sku ngo rdzong dpon zer ba'i dgra ngan de ni nga tsho mi shi khyim stongs bzo mkhan gyi gshed ma rang yin pas/__,https://d38pmlk0v88drf.cloudfront.net/wav16k/STT_AB00335_0112_873353_to_883762.wav,STT_AB,2,166,10.409,wav16k/STT_AB00335_0112_873353_to_883762.wav,དཀའ་སྡུབ་ཚད་མེད་མྱངས་ཤིང་ལུས་ལ་གཅོང་ནས་བཞུགས་པའི་རྐྱེན་གྱིས་མཐར་ཚེ་ལས་འདས། སྐུ་ངོ་རྫོང་ན་ཟེར་བའི་སགྲ་ངན་དེ་ནི་ང་ཚོ་མི་ཤི་ཁྱིམ་སྟོང་བཟོ་མཁན་གྱི་ཤེལ་མ་རང་ཡིན་པས་
STT_AB00335_0114_896021_to_907238,དུས་རྟག་ཏུ་འདྲི་རྩད་དང་དོ་སྣང་བྱས་ཀྱང་། ད་བར་སྲུ་མོའི་དྲི་མ་ཙམ་ཡང་མ་རྙེད་ལ་སྐུ་ངོ་རྫོང་ཟེར་བ་དེ་སུ་ཡིན་རྩད་ཀྱང་མ་ཆོད་པར་བརྟེན། སྐུ་ངོ་མདའ་དཔོན་ཁྱེད་ཀྱིས་ངེས་པར་དུ་ ,dus rtag tu 'dri rtsad dang do snang byas kyang /_da bar sru mo'i dri ma tsam yang ma rnyed la sku ngo rdzong zer ba de su yin rtsad kyang ma chod par brten/_sku ngo mda' dpon khyed kyis nges par du _,https://d38pmlk0v88drf.cloudfront.net/wav16k/STT_AB00335_0114_896021_to_907238.wav,STT_AB,2,164,11.217,wav16k/STT_AB00335_0114_896021_to_907238.wav,དུས་རྟག་ཏུ་འདྲིལ་རྩད་དང་དོ་སྣང་བྱས་ཀྱང་། ད་བར་སྲུ་མོའི་དྲིབ་མ་ཙམ་ཡང་མ་རྙེད་ལ་ སྐུ་ངོ་རྫོང་ན་ཟེར་བ་དེ་སུ་ཡིན་རྩད་ཀྱང་མ་གཅོད་པར་བརྟེན་སྐུ་ངོ་མདའ་དཔོན་ཁྱེད་ཀྱིས་ངེས་པར་དུ་
STT_AB00507_0112_424360_to_425059,ཉར་གྱི་ཡོད།  ,nyar gyi yod/__,https://d38pmlk0v88drf.cloudfront.net/wav16k/STT_AB00507_0112_424360_to_425059.wav,STT_AB,2,13,0.699,wav16k/STT_AB00507_0112_424360_to_425059.wav,ཉར་གྱི་ཡོད།
STT_AB00335_0115_907238_to_918455,བདག་གི་བསམ་འདུན་ཡོངས་སུ་འགྲུབ་པའི་ཆེད་དུ་བཀའ་སློབ་རྒྱབ་སྐྱོར་གང་ཆེ་གནང་རོགས་ཞུ་རྒྱུ་ཡིན་ཞེས་གུས་ཞབས་དང་ལྡན་ལ་སྐོམ་པ་ཆུ་འདོད་ཀྱི་རེ་བའི་མིག་འབྲས་ཟུང་མདའ་དཔོན་གྱི་གདོང་ལ་ལྟ་བཞིན་དུ་སྨྲད།  ,bdag gi bsam 'dun yongs su 'grub pa'i ched du bka' slob rgyab skyor gang che gnang rogs zhu rgyu yin zhes gus zhabs dang ldan la skom pa chu 'dod kyi re ba'i mig 'bras zung mda' dpon gyi gdong la lta bzhin du smrad/__,https://d38pmlk0v88drf.cloudfront.net/wav16k/STT_AB00335_0115_907238_to_918455.wav,STT_AB,2,186,11.217,wav16k/STT_AB00335_0115_907238_to_918455.wav,བདག་གི་བསམ་འདུན་ཡོངས་སུ་འགྲུབ་པའི་ཆེད་དུ་བཀའ་སློབ་རྒྱབ་སྐྱོར་གང་ཆེ་གནང་རོགས་ཞུ་རྒྱུ་ཡིན་ཞེས་གུས་ཞབས་དང་ལྡན་ལ་དཀོན་པ་ཆུ་འདོས་ཀྱི་རེ་བའི་མིག་འབྲས་ཟུང་མདའ་དཔོན་གྱི་གདོང་ལ་ལྟ་བཞིན་དུ་སྨྲས།
STT_AB00335_0116_919803_to_927064,དེའི་ཚེ་དེའི་དུས་དཔལ་ལྡན་གྱི་བསམ་ཡུལ་ལས་འདས་པ་ཞིག་ལ། སྐུ་ངོ་མདའ་དཔོན་གྱིས་གཏམ་དེ་རྣམས་ཐོས་རྗེས་སུ་རང་ཉིད་ ,de'i tshe de'i dus dpal ldan gyi bsam yul las 'das pa zhig la/_sku ngo mda' dpon gyis gtam de rnams thos rjes su rang nyid _,https://d38pmlk0v88drf.cloudfront.net/wav16k/STT_AB00335_0116_919803_to_927064.wav,STT_AB,2,106,7.261,wav16k/STT_AB00335_0116_919803_to_927064.wav,དེའི་ཚེ་དེའི་དུས་དཔལ་ལྡན་གྱི་བསམ་ཡུལ་ལས་འདས་པ་ཞིག་ལ། སྐུ་ངོ་མདའ་དཔོན་གྱིས་གཏམ་དེ་ཐོས་རྗེས་རང་ཉིད་
STT_AB00335_0117_927064_to_934325,ལ་གདུང་སེམས་མཉམ་སྐྱེད་ཀྱིས་སྤྲོ་སེམས་འཁོལ་བའི་རྒྱབ་སྐྱོར་བྱ་རྒྱུ་ཕར་བཞག ཐར་ཡོང་དང་མི་ཡོང་གི་ཚིག་ལན་ཙམ་ཡང་མ་བཏབ་པར་ ,la gdung sems mnyam skyed kyis spro sems 'khol ba'i rgyab skyor bya rgyu phar bzhag_thar yong dang mi yong gi tshig lan tsam yang ma btab par _,https://d38pmlk0v88drf.cloudfront.net/wav16k/STT_AB00335_0117_927064_to_934325.wav,STT_AB,2,115,7.261,wav16k/STT_AB00335_0117_927064_to_934325.wav,ལ་གདུང་སེམས་མཉམ་སྐྱེས་ཀྱིས་སྤྲོ་སེམས་འཁོལ་བའི་རྒྱབ་སྐྱོར་བྱ་རྒྱུ་ཕར་བཞག ཐ་ན་ཡོངས་དང་མི་ཡོང་གི་ཚིག་ལན་ཙམ་ཡང་མ་བཏབ་པར་
STT_AB00335_0119_942542_to_949991,གྱིས་ལོ་ཉི་ཤུའི་སྔོན་ལ་ང་ལྷོ་ཁ་བྲག་དཀར་རྫོང་དུ་རྫོང་དཔོན་བྱས་ནས་སྡོད་སྐབས་ཀྱི་གནས་ཚུལ་ཞིག་དྲན་གསོ་བྱེད་དུ་བཅུག་སོང་།  ,gyis lo nyi shu'i sngon la nga lho kha brag dkar rdzong du rdzong dpon byas nas sdod skabs kyi gnas tshul zhig dran gso byed du bcug song /__,https://d38pmlk0v88drf.cloudfront.net/wav16k/STT_AB00335_0119_942542_to_949991.wav,STT_AB,2,118,7.449,wav16k/STT_AB00335_0119_942542_to_949991.wav,ལོ་ངོ་ཉི་ཤུའི་སྔོན་ལ་ང་ལྷོ་ཁ་བྲག་དཀར་རྫོང་དུ་རྫོང་དཔོན་བྱས་ནས་སྡོད་སྐབས་ཀྱི་གནས་ཚུལ་ཞིག་དྲན་གསོ་བྱེད་དུ་བཅུག་སོང་།
STT_AB00335_0122_973233_to_980691,ཁྱོད་ཚོའི་དང་ཐོག་གི་ཕ་ཡུལ་ག་པར་རེད་དམ་ཞེས་དྲིས་པའི་ལན་དུ་དང་ཐོག་གི་ཕ་ཡུལ་ནི་ལྷོ་ཁ་བྲག་དཀར་རྫོང་རེད།  ,khyod tsho'i dang thog gi pha yul ga par red dam zhes dris pa'i lan du dang thog gi pha yul ni lho kha brag dkar rdzong red/__,https://d38pmlk0v88drf.cloudfront.net/wav16k/STT_AB00335_0122_973233_to_980691.wav,STT_AB,2,101,7.458,wav16k/STT_AB00335_0122_973233_to_980691.wav,ཁྱོད་ཚོའི་དྭང་ཚོག་གི་ཕ་ཡུལ་ག་བ་རེད་དམ་ཞེས་དྲིས་པའི་ལན་དུ་དང་ཐོག་གི་ཕ་ཡུལ་ནི་ལྷོ་ཁ་བྲག་དཀར་རྫོང་རེད།
STT_AB00507_0116_439718_to_440793,ཞི་མི་ཁྱེད་རང་ ,zhi mi khyed rang _,https://d38pmlk0v88drf.cloudfront.net/wav16k/STT_AB00507_0116_439718_to_440793.wav,STT_AB,2,15,1.075,wav16k/STT_AB00507_0116_439718_to_440793.wav,ཞི་མི་ཁྱེད་རང་
STT_AB00335_0124_985247_to_995456,ངའི་དྲིན་ཅན་ཕ་མ་གཉིས་ཀྱི་མིང་ལ་ཨ་ཕ་ཕུན་ཚོགས་དང་ཨ་མ་འཛོམས་པ་ཟེར་ཞེས་དྲི་བ་དང་དྲིས་ལན་ཚིག་ཉུང་ངུ་ཞིག་གིས་ཀྱང་མདའ་དཔོན་གྱི་སེམས་སུ་གནས་ཚུལ་རྣམས་མེ་ ,nga'i drin can pha ma gnyis kyi ming la a pha phun tshogs dang a ma 'dzoms pa zer zhes dri ba dang dris lan tshig nyung ngu zhig gis kyang mda' dpon gyi sems su gnas tshul rnams me _,https://d38pmlk0v88drf.cloudfront.net/wav16k/STT_AB00335_0124_985247_to_995456.wav,STT_AB,2,145,10.209,wav16k/STT_AB00335_0124_985247_to_995456.wav,ངའི་དྲིན་ཅན་ཕ་མ་གཉིས་ཀྱི་མིང་ལ་ཨ་ཕ་ཕུན་ཚོགས་དང་ཨ་མ་འཛོམས་པ་ཟེར་ཞེས་དྲི་བ་དང་དྲིས་ལན་ཚིག་ཉུང་ངུ་ཞིག་གིས་ཀྱང་མདའ་དཔོན་གྱི་སེམས་སུ་གནས་ཚུལ་རྣམས་མེ་་
STT_AB00335_0127_1015874_to_1026083,བྱེད་རྩིས་ཡོད་དམ་སྙམ་ནས་ཞེད་སྣང་སྐྱེས་ཏེ་སྙིང་ཡང་འདིག འདིག འདིག་ཅེས་འཕར་བ་རང་གིས་ཐོས་རུང་། ཕྱི་ཚུལ་དུ་སྒམ་བརླིང་གི་རྣམ་པའི་ཐོག་ནས་དཔལ་ལྡན།  ,byed rtsis yod dam snyam nas zhed snang skyes te snying yang 'dig_'dig_'dig ces 'phar ba rang gis thos rung /_phyi tshul du sgam brling gi rnam pa'i thog nas dpal ldan/__,https://d38pmlk0v88drf.cloudfront.net/wav16k/STT_AB00335_0127_1015874_to_1026083.wav,STT_AB,2,140,10.209,wav16k/STT_AB00335_0127_1015874_to_1026083.wav,བྱེད་རྩིས་ཡོད་དམ་སྙམ་ནས་ཞེད་སྣང་སྐྱེས་ཏེ་སྙིང་ཡང་སྡིག་རྡིག་འྡིག་ཅེས་འཕར་བ་རང་གིས་ཐོས་རུང་། ཕྱི་ཚུལ་དུ་སྒམ་བརླིང་གི་རྣམ་པའི་ཐོག་ནས་དཔལ་ལྡན།
STT_AB00335_0132_1059360_to_1066766,གལ་ཏེ་ངས་སྔོན་ལ་ལག་པ་མ་བཀྱགས་ཚེ། སྔ་ཕྱི་ལ་མ་བལྟོས་པར་སྤྲང་ཕྲུག་འདིས་གནས་ཚུལ་ཚང་མ་རྟོགས་ཏེ་ང་ལ་གནོད་པ་བྱེད་ངེས་རེད།  ,gal te ngas sngon la lag pa ma bkyags tshe/_snga phyi la ma bltos par sprang phrug 'dis gnas tshul tshang ma rtogs te nga la gnod pa byed nges red/__,https://d38pmlk0v88drf.cloudfront.net/wav16k/STT_AB00335_0132_1059360_to_1066766.wav,STT_AB,2,116,7.406,wav16k/STT_AB00335_0132_1059360_to_1066766.wav,གལ་ཏེ་ངས་སྔོན་ལ་ལག་པ་མ་བཀྱག་ཚེ་སྔ་ཕྱི་ལ་མ་ལྟོས་པར་སྤྲང་ཕྲུག་འདིས་གནས་ཚུལ་ཚང་མ་རྟོགས་ཏེ་ང་ལ་གནོད་པ་བྱེད་ངེས་རེད།
STT_AB00335_0134_1074445_to_1083745,སྐད་ཆ་ཚིག་གཅིག་ཀྱང་མ་བཤད་པར་གློ་བུར་དུ་ཧད་ཀྱིས་ལངས་ཏེ་བྲེལ་འཚུབ་ཆེ་བའི་གོམ་བགྲོད་དང་བཅས་གསང་ཡོལ་གྱི་ཕྱི་རོལ་དུ་སོང་། དེ་ནས་ཡང་གློ་བུར་དུ་ ,skad cha tshig gcig kyang ma bshad par glo bur du had kyis langs te brel 'tshub che ba'i gom bgrod dang bcas gsang yol gyi phyi rol du song /_de nas yang glo bur du _,https://d38pmlk0v88drf.cloudfront.net/wav16k/STT_AB00335_0134_1074445_to_1083745.wav,STT_AB,2,138,9.3,wav16k/STT_AB00335_0134_1074445_to_1083745.wav,སྐད་ཆ་ཚིག་གཅིག་ཀྱང་མ་བཤད་པར་གློ་བུར་དུ་ཧད་ཀྱིས་ལངས་ཏེ་འབྲེལ་འཚུབ་ཆེ་བའི་གོམ་བགྲོས་དང་བཅས་གསང་ཡོལ་གྱི་ཕྱི་རོལ་དུ་ཕྱིན། དེ་ནས་ཡང་གློ་བུར་དུ་
